{"aggregates":[{"allocationBytes":4096,"category":"application","className":"com.salesforce.revoman.ReVoman","executionSamples":12,"methodName":"revUp"}],"captureId":"capture-0001","droppedSamples":{"events":0,"stackTraces":0},"durationNanos":1000000,"profiler":{"kind":"jfr","settingsSha256":"aaaaaaaaaaaaaaaaaaaaaaaaaaaaaaaaaaaaaaaaaaaaaaaaaaaaaaaaaaaaaaaa","variantSha256":"aaaaaaaaaaaaaaaaaaaaaaaaaaaaaaaaaaaaaaaaaaaaaaaaaaaaaaaaaaaaaaaa"},"rawInputSha256":"aaaaaaaaaaaaaaaaaaaaaaaaaaaaaaaaaaaaaaaaaaaaaaaaaaaaaaaaaaaaaaaa","schemaVersion":"profiler-summary-v1"}
